Question,Category,Question Text,Question Type,Response Option 1,Skip questions 1,Response Option 2,Skip questions 2,Response Option 3,Skip questions 3,Response Option 4,Skip questions 4,Response Option 5,Skip questions 5,Response Option 6,Skip questions 6,Actions
fertilizer,Yard/Landscaping,Do you use fertilizer on your yard?,Choice,No,fertilizer_applications,Yes,,,,,,,,,,reduce_lawn_care
fertilizer_applications,Yard/Landscaping,Will you choose to reduce your fertilizer applications this year?,Choice,No,,1 less,,2 less,,3 less ,,,,,,reduce_lawn_care
leaf_cleanup_gas_blower,Yard/Landscaping,Do you use a gas blower to clean leaves?,Choice,No,leaf_cleanup_blower_switch,Yes,,,,,,,,,,rake_elec_blower
leaf_cleanup_blower_switch,Yard/Landscaping,Will you choose to switch from gas blower to rake or electric blower?,Choice,No,,Yes,,,,,,,,,,rake_elec_blower
lawn_service,Yard/Landscaping,Do you use a landscape service to take care of your lawn?,Choice,Yes,,No,,,,,,,,,,reduce_lawn_care
lawn_size,Yard/Landscaping,How large is your lawn?,Choice,Small (<500 sq ft),,Medium (500-2000 sq ft),,Sizable (2000-5000 sq ft),,Large (>5000 sq ft),,,,,,"reduce_lawn_size,reduce_lawn_care,electric_mower"